load_id,source_name,file_name,drop_date,current_path,incoming_path,rows_written,notes
090e0f5dd752,facility_master,facility_master.csv,2026-03-31,data/source_extracts/facility_master/current/facility_master.csv,data/source_extracts/facility_master/incoming/2026/03/31/facility_master.csv,5,Clean reference file for facility dimension and grid-region mapping.
090e0f5dd752,product_line_master,product_line_master.csv,2026-03-31,data/source_extracts/product_line_master/current/product_line_master.csv,data/source_extracts/product_line_master/incoming/2026/03/31/product_line_master.csv,4,Clean reference file for product-line intensity reporting.
090e0f5dd752,electricity_bills,electricity_bills_monthly.xlsx,2026-03-31,data/source_extracts/electricity_bills/current/electricity_bills_monthly.xlsx,data/source_extracts/electricity_bills/incoming/2026/03/31/electricity_bills_monthly.xlsx,78,"Scope 2 activity; duplicates, missing facility IDs, mixed month formats, negative usage, and unit drift injected."
090e0f5dd752,fuel_usage,fuel_usage_facility.csv,2026-03-31,data/source_extracts/fuel_usage/current/fuel_usage_facility.csv,data/source_extracts/fuel_usage/incoming/2026/03/31/fuel_usage_facility.csv,109,"Scope 1 activity; fuel type casing drift, missing facility IDs, negative amounts, and unit synonyms injected."
090e0f5dd752,shipping_miles,shipping_miles_logistics.csv,2026-03-31,data/source_extracts/shipping_miles/current/shipping_miles_logistics.csv,data/source_extracts/shipping_miles/incoming/2026/03/31/shipping_miles_logistics.csv,1719,"Scope 3 freight activity; duplicate shipments, missing keys, casing drift, and negative ton-miles injected."
090e0f5dd752,packaging_materials,packaging_materials_procurement.csv,2026-03-31,data/source_extracts/packaging_materials/current/packaging_materials_procurement.csv,data/source_extracts/packaging_materials/incoming/2026/03/31/packaging_materials_procurement.csv,562,"Scope 3 purchased packaging activity; missing keys, material casing drift, mixed month formats, and negative weights injected."
090e0f5dd752,emission_factors,emission_factors_reference.csv,2026-03-31,data/source_extracts/emission_factors/current/emission_factors_reference.csv,data/source_extracts/emission_factors/incoming/2026/03/31/emission_factors_reference.csv,16,"Versioned synthetic factor table for Scope 1, Scope 2, and Scope 3 calculations."
